kategorie,frage,option_1,option_2,option_3,option_4,richtige_antwort,erklaerung
Betriebssysteme,Welche Windows-Version wurde erstmals mit dem Startmenü eingeführt?,Windows 7,Windows 8,Windows 10,Windows XP,Windows 95,Windows 95 wurde erstmals mit dem Startmenü eingeführt das später ein wesentliches Merkmal aller folgenden Windows-Versionen wurde.
Betriebssysteme,Welcher Linux-Befehl wird verwendet um das aktuelle Verzeichnis anzuzeigen?,ls,pwd,cd,cp,pwd,"pwd" zeigt das aktuelle Arbeitsverzeichnis in einem Linux-Terminal an.
Betriebssysteme,Welches der folgenden Dateisysteme wird von Linux nicht unterstützt?,ext4,NTFS,HFS+,FAT32,NTFS,NTFS ist ein Dateisystem das von Microsoft Windows verwendet wird und nicht nativ von Linux unterstützt wird.
Betriebssysteme,Was ist eine bekannte Desktop-Umgebung für Linux?,GNOME,KDE,Unity,Alle oben genannten,Alle oben genannten,GNOME KDE und Unity sind bekannte Desktop-Umgebungen für Linux.
Betriebssysteme,Welche Windows-Version wurde als Nachfolger von Windows XP veröffentlicht?,Windows Vista,Windows 7,Windows 8,Windows 10,Windows Vista,Windows Vista wurde als Nachfolger von Windows XP veröffentlicht.
Betriebssysteme,Was ist ein Hauptmerkmal von Linux im Vergleich zu Windows?,Open Source,Lizenzgebühren,Kompatibilität,Alle oben genannten,Open Source,Linux ist Open Source während Windows lizenziert ist und Lizenzgebühren erfordert. Linux bietet auch eine hohe Kompatibilität und Flexibilität.
Betriebssysteme,Welches Linux-basierte Betriebssystem wird häufig in der Sicherheitsforschung verwendet?,Ubuntu,Kali Linux,Debian,Red Hat,Kali Linux,Kali Linux ist eine speziell auf Sicherheitstests und Penetrationstests ausgerichtete Linux-Distribution.
Betriebssysteme,Welche Windows-Edition richtet sich hauptsächlich an Unternehmen und Großkunden?,Windows Home,Windows Professional,Windows Enterprise,Windows Ultimate,Windows Enterprise,Windows Enterprise ist für Unternehmen und Großkunden konzipiert und bietet erweiterte Funktionen für Netzwerke und Sicherheit.
Betriebssysteme,Welcher Befehl wird in Linux verwendet um einen Prozess zu beenden?,terminate,kill,exit,stop,kill,Der Befehl "kill" wird in Linux verwendet um einen laufenden Prozess zu beenden.
Betriebssysteme,Was ist der Hauptvorteil von virtuellen Maschinen in Betriebssystemen?,Ressourcenpartitionierung,Erhöhte Speicherkapazität,Verbesserte Netzwerkgeschwindigkeit,Erweiterte Benutzeroberfläche,Ressourcenpartitionierung,Der Hauptvorteil von virtuellen Maschinen besteht darin dass sie die Ressourcen eines physischen Computers effizient partitionieren können.
Betriebssysteme,Welche der folgenden ist keine Aufgabe eines Betriebssystems?,Hardwareüberwachung,Softwareinstallation,Datenverschlüsselung,Grafikdesign,Datenverschlüsselung,Datenverschlüsselung ist keine primäre Aufgabe eines Betriebssystems sondern wird häufig durch spezielle Software oder Anwendungen durchgeführt.
Betriebssysteme,Was ist ein Vorteil der Verwendung von Linux-Servern gegenüber Windows-Servern?,Kostenfreiheit,Höhere Komplexität,Bessere Benutzerfreundlichkeit,Stärkere Sicherheitslücken,Kostenfreiheit,Die Verwendung von Linux-Servern bietet den Vorteil der Kostenfreiheit im Vergleich zu Windows-Servern die lizenziert sind.
Betriebssysteme,Welche Windows-Edition ist für den Heimgebrauch konzipiert?,Windows Professional,Windows Ultimate,Windows Home,Windows Enterprise,Windows Home,Windows Home ist für den Heimgebrauch konzipiert und bietet grundlegende Funktionen für private Nutzer.
Betriebssysteme,Welche der folgenden ist ein Beispiel für ein Paketverwaltungssystem in Linux?,apt-get,yum,pkg,dnf,apt-get,apt-get ist ein Paketverwaltungssystem das in Debian-basierten Linux-Distributionen verwendet wird.
Betriebssysteme,Welches Betriebssystem ist bekannt für seine Verwendung auf Servern und Workstations?,Windows,macOS,Linux,Android,Linux,Linux ist bekannt für seine Verwendung auf Servern und Workstations aufgrund seiner Stabilität und Flexibilität.
Betriebssysteme,Was ist ein Hauptmerkmal von Windows im Vergleich zu Linux?,Proprietäre Lizenz,Open Source,Kommandozeilen-Orientierung,Web-basierte Benutzeroberfläche,Proprietäre Lizenz,Windows ist ein proprietäres Betriebssystem das einer Lizenzierung unterliegt während Linux Open Source ist.
Betriebssysteme,Was ist ein Vorteil der Verwendung von Windows für Spieleentwicklung?,DirectX-Unterstützung,Kernel-Modifikationen,Open Source-Lizenzierung,Textbasierte Benutzeroberfläche,DirectX-Unterstützung,Windows bietet Unterstützung für DirectX eine API für Multimedia und Spieleentwicklung.
Betriebssysteme,Welches Linux-basierte Betriebssystem wird häufig für seine Sicherheit und Datenschutzfunktionen verwendet?,Ubuntu,Kali Linux,Debian,Red Hat,Kali Linux,Kali Linux wird häufig für Sicherheitstests und Penetrationstests verwendet.
Betriebssysteme,Welches Windows-Betriebssystem wurde speziell für Tablet-Computer entwickelt?,Windows 7,Windows 8,Windows 10,Windows XP,Windows 8,Windows 8 wurde speziell für die Verwendung auf Tablet-Computern entwickelt.
Betriebssysteme,Welche Linux-Distribution ist bekannt für ihre Verwendung in eingebetteten Systemen und IoT-Geräten?,Ubuntu,Fedora,Debian,Embedded Linux,Embedded Linux,Embedded Linux ist eine spezialisierte Linux-Distribution für eingebettete Systeme und IoT-Geräte.
Betriebssysteme,Welches Windows-Feature ermöglicht es zwei Programme gleichzeitig auf dem Bildschirm anzuzeigen?,Snap Assist,Virtual Desktops,Task View,Action Center,Snap Assist,Die Snap Assist-Funktion in Windows ermöglicht es zwei Programme gleichzeitig auf dem Bildschirm anzuzeigen und sie zu verwalten.
Betriebssysteme,Welches Linux-Betriebssystem wird häufig in der Cloud-Computing-Infrastruktur verwendet?,Ubuntu,Fedora,Red Hat,CentOS,CentOS,CentOS wird häufig in der Cloud-Computing-Infrastruktur aufgrund seiner Stabilität und Zuverlässigkeit verwendet.
Betriebssysteme,Welche Windows-Edition ist für den Einsatz in großen Unternehmen und Organisationen vorgesehen?,Windows Home,Windows Professional,Windows Enterprise,Windows Ultimate,Windows Enterprise,Windows Enterprise bietet erweiterte Funktionen für Unternehmen und Organisationen.
Betriebssysteme,Welche Linux-Distribution ist bekannt für ihre Verwendung in wissenschaftlichen Berechnungen und Forschungseinrichtungen?,Ubuntu,Fedora,Debian,Scientific Linux,Scientific Linux,Scientific Linux ist für seine Verwendung in wissenschaftlichen Berechnungen und Forschungseinrichtungen optimiert.
Projektmanagement,"Was ist die primäre Aufgabe des Projektmanagements?",Ressourcen verwalten,Projektziele definieren,Projektergebnisse kontrollieren,Alle der Genannten,Projektziele definieren,"Das Projektmanagement ist verantwortlich für die Definition und Erreichung der Projektziele in Bezug auf Kosten, Termin und Qualität."
Projektmanagement,"Was versteht man unter dem Begriff ""Projektzyklus""?",Die Dauer eines Projekts,Die Phasen eines Projekts,Die Wiederholung eines Projekts,Den Lebenszyklus eines Produkts,Die Phasen eines Projekts,"Der Projektzyklus beschreibt die verschiedenen Phasen eines Projekts, z.B. Initiierung, Planung, Durchführung, Kontrolle und Abschluss."
Projektmanagement,"Welche Methode wird häufig zur Projektplanung verwendet?",Gantt-Diagramm,Netzplantechnik,Kanban,Scrum,Netzplantechnik,"Die Netzplantechnik ist eine Methode zur Darstellung und Planung von Projektaktivitäten und deren Abhängigkeiten."
Projektmanagement,"Was ist das wichtigste Dokument in der Projektplanung?",Projekthandbuch,Projektstrukturplan,Projektantrag,Projektbudget,Projektstrukturplan,"Der Projektstrukturplan (PSP) ist das zentrale Dokument, das die Arbeitspakete und deren Abhängigkeiten definiert."
Projektmanagement,"Was ist die Hauptaufgabe des Projektleiters?",Ressourcenplanung,Risikomanagement,Koordination und Kontrolle,Zeitmanagement,Koordination und Kontrolle,"Der Projektleiter ist verantwortlich für die Koordination und Kontrolle aller Projektaktivitäten, um die Projektziele zu erreichen."
Projektmanagement,"Wie bezeichnet man die Bestimmung des zeitlichen Ablaufs von Aktivitäten?",Ressourcenplanung,Prozessmanagement,Terminplanung,Risikomanagement,Terminplanung,"Die Terminplanung legt fest, wann welche Aktivitäten im Projekt durchgeführt werden sollen."
Projektmanagement,"Was ist der Hauptzweck der Risikoanalyse?",Risiken bewerten,Risiken identifizieren,Risiken vermeiden,Alle der Genannten,Risiken identifizieren,"Die Risikoanalyse dient dazu, potenzielle Risiken für das Projekt zu identifizieren und deren Auswirkungen abzuschätzen."
Projektmanagement,"Welche Methode eignet sich zur Visualisierung von Prozessen?",Netzplantechnik,Flussdiagramm,Gantt-Diagramm,Ishikawa-Diagramm,Flussdiagramm,"Flussdiagramme eignen sich gut zur Visualisierung von Prozessabläufen und Entscheidungspunkten."
Projektmanagement,"Was versteht man unter dem Begriff ""Projektportfolio""?",Eine Sammlung von Projekten,Ein Projektplan,Ein Projektteam,Eine Projektmethode,Eine Sammlung von Projekten,"Ein Projektportfolio ist eine Sammlung aller laufenden oder geplanten Projekte einer Organisation."
Projektmanagement,"In welcher Phase des Projektmanagements erfolgt die Festlegung der Projektorganisation?",Initiierungsphase,Planungsphase,Durchführungsphase,Abschlussphase,Planungsphase,"Die Festlegung der Projektorganisation, wie z.B. der Projektleiter und das Projektteam, erfolgt in der Planungsphase."
Projektmanagement,"Was ist das Ziel der Ressourcenplanung?",Personaleinsatz optimieren,Termine planen,Risiken identifizieren,Kosten schätzen,Personaleinsatz optimieren,"Die Ressourcenplanung hat das Ziel, den Einsatz von Personal, Material und Ausrüstung im Projekt zu optimieren."
Projektmanagement,"Welche Technik wird häufig zur Visualisierung von Ursache-Wirkungszusammenhängen verwendet?",Flussdiagramm,Netzplantechnik,Ishikawa-Diagramm,Gantt-Diagramm,Ishikawa-Diagramm,"Das Ishikawa-Diagramm (auch Ursache-Wirkungsdiagramm genannt) dient der Visualisierung von Ursachen für ein bestimmtes Problem oder Ergebnis."
Projektmanagement,"Was versteht man unter der Methode ""Earned Value Analysis""?",Eine Projektmanagement-Methode,Eine Methode zur Kostenkontrolle,Eine Methode zur Terminkontrolle,Eine Methode zur integrierten Projekt-Kontrolle,Eine Methode zur integrierten Projekt-Kontrolle,"Die Earned Value Analysis ist eine Methode zur integrierten Kontrolle von Kosten, Terminen und Leistungsstand in Projekten."
Projektmanagement,"Was ist das Hauptziel des Anforderungsmanagements?",Risiken minimieren,Änderungen kontrollieren,Ressourcen optimieren,Anforderungen dokumentieren,Anforderungen dokumentieren,"Das Anforderungsmanagement dient der Dokumentation, Priorisierung und Verwaltung von Anforderungen an das Projekt oder Produkt."
Projektmanagement,"Welche Methode eignet sich zur Visualisierung von Prozessabläufen mit Entscheidungspunkten?",Gantt-Diagramm,Ishikawa-Diagramm,Flussdiagramm,Netzplantechnik,Flussdiagramm,"Flussdiagramme eignen sich gut zur Visualisierung von Prozessabläufen mit Entscheidungspunkten und Verzweigungen."
Projektmanagement,"Was ist der Hauptzweck der Projektabnahme?",Kostenkontrolle,Qualitätssicherung,Abrechnung,Projektdokumentation,Qualitätssicherung,"Die Projektabnahme dient der Qualitätssicherung und Bestätigung, dass das Projektergebnis den Anforderungen entspricht."
Projektmanagement,"Welche Methode wird häufig zur Priorisierung von Anforderungen verwendet?",Netzplantechnik,Earned Value Analysis,Ishikawa-Diagramm,MoSCoW-Methode,MoSCoW-Methode,"Die MoSCoW-Methode dient der Priorisierung von Anforderungen in die Kategorien ""Must have"", ""Should have"", ""Could have"" und ""Won't have""."
Projektmanagement,"Was ist das Hauptziel des Risikomanagements?",Risiken akzeptieren,Risiken identifizieren und bewerten,Risiken vermeiden,Risiken übertragen,Risiken identifizieren und bewerten,"Das Hauptziel des Risikomanagements ist die Identifizierung, Bewertung und angemessene Behandlung von Projektrisiken."
Projektmanagement,"Welche Methode eignet sich zur Visualisierung von Abhängigkeiten zwischen Aktivitäten?",Gantt-Diagramm,Flussdiagramm,Netzplantechnik,Ishikawa-Diagramm,Netzplantechnik,"Die Netzplantechnik eignet sich gut zur Visualisierung von Aktivitäten und deren Abhängigkeiten in Form eines Netzplans."
Projektmanagement,"Was ist der Hauptzweck des Projektcontrollings?",Projektergebnisse bewerten,Projektfortschritt überwachen,Projektrisiken identifizieren,Projektziele definieren,Projektfortschritt überwachen,"Das Projektcontrolling dient der kontinuierlichen Überwachung des Projektfortschritts in Bezug auf Termine, Kosten und Leistung."
Projektmanagement,"Welche Methode wird häufig zur Priorisierung von Projekten in einem Projektportfolio verwendet?",Netzplantechnik,Scoring-Modell,Flussdiagramm,Earned Value Analysis,Scoring-Modell,"Scoring-Modelle werden häufig zur Priorisierung von Projekten in einem Projektportfolio basierend auf definierten Kriterien verwendet."
Projektmanagement,"Was ist der Hauptzweck der Projektdokumentation?",Wissensmanagement,Projektfortschritt überwachen,Risiken identifizieren,Projektziele definieren,Wissensmanagement,"Die Projektdokumentation dient dem Wissensmanagement und der Sicherung von Erfahrungen und Lessons Learned für zukünftige Projekte."
Projektmanagement,"Welche Methode eignet sich zur Visualisierung von Abhängigkeiten zwischen Ressourcen?",Gantt-Diagramm,Flussdiagramm,Netzplantechnik,Ishikawa-Diagramm,Netzplantechnik,"Die Netzplantechnik kann auch zur Visualisierung von Ressourcenabhängigkeiten und deren Auswirkungen auf den Projektablauf verwendet werden."
Projektmanagement,"Was ist der Hauptzweck des Änderungsmanagements?",Kostenkontrolle,Risikominimierung,Änderungen kontrollieren,Qualitätssicherung,Änderungen kontrollieren,"Das Änderungsmanagement dient der kontrollierten Umsetzung von Änderungen im Projekt, um Auswirkungen auf Termine, Kosten und Qualität zu minimieren."
Projektmanagement,"Welche Methode eignet sich zur Visualisierung von Ursachen für Probleme?",Gantt-Diagramm,Ishikawa-Diagramm,Netzplantechnik,Flussdiagramm,Ishikawa-Diagramm,"Das Ishikawa-Diagramm (Ursache-Wirkungsdiagramm) eignet sich gut zur Visualisierung von Ursachen für ein bestimmtes Problem."
Projektmanagement,"Was ist das Hauptziel der Statusberichterstattung?",Risiken kommunizieren,Projektfortschritt berichten,Änderungen dokumentieren,Ressourcen planen,Projektfortschritt berichten,"Die Statusberichterstattung dient dazu, den aktuellen Projektstand und -fortschritt an alle Beteiligten zu kommunizieren."
Projektmanagement,"Welche Methode eignet sich zur Visualisierung von Projekten in einer Roadmap?",Gantt-Diagramm,Netzplantechnik,Flussdiagramm,Projektportfolio-Roadmap,Projektportfolio-Roadmap,"Eine Projektportfolio-Roadmap dient der Visualisierung und Planung von Projekten in einer zeitlichen Übersicht."
Projektmanagement,"Was ist der Hauptzweck der Kommunikationsplanung?",Risiken minimieren,Informationsaustausch planen,Ressourcen optimieren,Kosten schätzen,Informationsaustausch planen,"Die Kommunikationsplanung legt fest, wer wann welche Informationen im Projekt erhält, um einen effizienten Informationsaustausch zu gewährleisten."
Projektmanagement,"Welche Methode eignet sich zur Visualisierung von Arbeitsabläufen?",Gantt-Diagramm,Flussdiagramm,Netzplantechnik,Ishikawa-Diagramm,Flussdiagramm,"Flussdiagramme eignen sich gut zur Visualisierung von Arbeitsabläufen, Prozessen und Entscheidungspunkten."
Projektmanagement,"Was ist der Hauptzweck des Qualitätsmanagements?",Risiken minimieren,Kosten kontrollieren,Qualitätsstandards sicherstellen,Termine überwachen,Qualitätsstandards sicherstellen,"Das Qualitätsmanagement dient dazu, die geforderten Qualitätsstandards für das Projektergebnis sicherzustellen."
Projektmanagement,"Welche Methode eignet sich zur Visualisierung von Arbeitsaufwänden?",Netzplantechnik,Flussdiagramm,Gantt-Diagramm,Ishikawa-Diagramm,Gantt-Diagramm,"Gantt-Diagramme eignen sich gut zur Visualisierung von Arbeitsaufwänden und deren zeitlicher Planung."
Projektmanagement,"Was ist das Hauptziel des Stakeholdermanagements?",Stakeholder zufriedenstellen,Risiken minimieren,Konflikte lösen,Ressourcen optimieren,Stakeholder zufriedenstellen,"Das Stakeholdermanagement hat das Ziel, die Bedürfnisse und Erwartungen aller am Projekt beteiligten Stakeholder zu berücksichtigen und deren Zufriedenheit zu erreichen."
Projektmanagement,"Welche Methode eignet sich zur Visualisierung von Prozessverbesserungen?",Gantt-Diagramm,Flussdiagramm,Ishikawa-Diagramm,Netzplantechnik,Flussdiagramm,"Flussdiagramme können gut zur Visualisierung von optimierten Prozessabläufen und Verbesserungen genutzt werden."
Projektmanagement,"Was ist der Hauptzweck der Projektaudit?",Konformität prüfen,Risiken bewerten,Qualität sicherstellen,Kosten kontrollieren,Konformität prüfen,"Das Projektaudit dient der Überprüfung, ob das Projekt den definierten Standards, Richtlinien und Vorschriften entspricht."
Projektmanagement,"Welche Methode eignet sich zur Visualisierung von Projektphasen?",Gantt-Diagramm,Flussdiagramm,Ishikawa-Diagramm,Netzplantechnik,Gantt-Diagramm,"Gantt-Diagramme können gut zur Visualisierung von Projektphasen und deren zeitlicher Planung verwendet werden."
Projektmanagement,"Was ist das Hauptziel des Vertragsmanagements?",Verträge verhandeln,Verträge überwachen,Verträge abschließen,Alle der Genannten,Alle der Genannten,"Das Vertragsmanagement umfasst alle Aktivitäten rund um das Verhandeln, Abschließen und Überwachen von Verträgen im Projekt."
Projektmanagement,"Welche Methode eignet sich zur Visualisierung von Projektrisiken?",Gantt-Diagramm,Ishikawa-Diagramm,Risikoregister,Netzplantechnik,Risikoregister,"Ein Risikoregister dient der Dokumentation und Visualisierung identifizierter Projektrisiken."
Projektmanagement,"Was ist der Hauptzweck der Projektabschlussanalyse?",Projekterfolg bewerten,Lessons Learned dokumentieren,Budget kontrollieren,Ressourcen planen,Lessons Learned dokumentieren,"Die Projektabschlussanalyse dient dazu, Lessons Learned aus dem Projekt zu dokumentieren, um aus Fehlern und Erfolgen für zukünftige Projekte zu lernen."
Bekannte Ports,Welcher Port wird typischerweise für HTTP verwendet?,80,443,22,8080,80,Port 80 wird typischerweise für unverschlüsselte HTTP-Verbindungen verwendet.
Bekannte Ports,Welcher Port wird für HTTPS verschlüsselte Verbindungen verwendet?,80,443,22,8080,443,Port 443 wird für HTTPS verschlüsselte Verbindungen verwendet.
Bekannte Ports,Welcher Port wird für SSH verwendet?,80,443,22,8080,22,Port 22 wird typischerweise für SSH (Secure Shell) verwendet.
Bekannte Ports,Welcher Port wird für FTP verwendet?,80,443,21,25,21,Port 21 wird typischerweise für FTP (File Transfer Protocol) verwendet.
Bekannte Ports,Welcher Port wird für SMTP verwendet?,80,443,25,110,25,Port 25 wird für SMTP (Simple Mail Transfer Protocol) verwendet um E-Mails zu übertragen.
Bekannte Ports,Welcher Port wird für DNS verwendet?,80,53,25,110,53,Port 53 wird für DNS (Domain Name System) verwendet um Domainnamen in IP-Adressen aufzulösen.
Bekannte Ports,Welcher Port wird für Telnet verwendet?,80,443,23,110,23,Port 23 wird für Telnet verwendet ein Netzwerkprotokoll zur Fernsteuerung eines Computers über das Internet oder ein lokales Netzwerk.
Bekannte Ports,Welcher Port wird für POP3 verwendet?,80,443,25,110,110,Port 110 wird für POP3 (Post Office Protocol Version 3) verwendet um E-Mails von einem Server abzurufen.
Bekannte Ports,Welcher Port wird für IMAP verwendet?,80,443,25,143,143,Port 143 wird für IMAP (Internet Message Access Protocol) verwendet um E-Mails auf einem Server zu verwalten.
Bekannte Ports,Welcher Port wird für SNMP verwendet?,80,443,25,161,161,Port 161 wird für SNMP (Simple Network Management Protocol) verwendet um Netzwerkgeräte zu überwachen und zu verwalten.
Bekannte Ports,Welcher Port wird für LDAP verwendet?,80,443,25,389,389,Port 389 wird für LDAP (Lightweight Directory Access Protocol) verwendet um Informationen aus einem Verzeichnisdienst abzurufen.
Bekannte Ports,Welcher Port wird für RDP verwendet?,80,443,22,3389,3389,Port 3389 wird für RDP (Remote Desktop Protocol) verwendet um eine Remote-Desktop-Verbindung zu einem Computer herzustellen.
Bekannte Ports,Welcher Port wird für MySQL-Datenbankverbindungen verwendet?,80,443,3306,8080,3306,Port 3306 wird typischerweise für MySQL-Datenbankverbindungen verwendet.
Bekannte Ports,Welcher Port wird für Oracle-Datenbankverbindungen verwendet?,80,443,1521,25,1521,Port 1521 wird für Oracle-Datenbankverbindungen verwendet.
Bekannte Ports,Welcher Port wird für Microsoft SQL Server-Datenbankverbindungen verwendet?,80,443,1433,25,1433,Port 1433 wird für Microsoft SQL Server-Datenbankverbindungen verwendet.
Bekannte Ports,Welcher Port wird für HTTPS-Proxyverbindungen verwendet?,80,443,8080,3128,443,Port 443 wird für HTTPS-Proxyverbindungen verwendet.
Bekannte Ports,Welcher Port wird für HTTP-Proxyverbindungen verwendet?,80,443,8080,3128,80,Port 80 wird für HTTP-Proxyverbindungen verwendet.
Bekannte Ports,Welcher Port wird für SMB (Server Message Block) verwendet?,80,443,445,8080,445,Port 445 wird für SMB (Server Message Block) verwendet ein Netzwerkprotokoll das für Datei- Drucker- und andere Kommunikationsdienste in einem Netzwerk verwendet wird.
Bekannte Ports,Welcher Port wird für FTPS (FTP über SSL/TLS) verwendet?,80,443,21,990,990,Port 990 wird für FTPS (FTP über SSL/TLS) verwendet eine sichere Variante von FTP.
Bekannte Ports,Welcher Port wird für SSH-Dateiübertragungen verwendet?,22,23,25,80,22,Port 22 wird für SSH-Dateiübertragungen verwendet.
Bekannte Ports,Welche Anwendung verwendet typischerweise Port 80?,SMTP,HTTP,SSH,FTP,HTTP,Port 80 wird typischerweise für HTTP-Verbindungen verwendet.
Bekannte Ports,Welche Anwendung verwendet typischerweise Port 443?,HTTP,SMTP,HTTPS,FTP,HTTPS,Port 443 wird typischerweise für verschlüsselte HTTPS-Verbindungen verwendet.
Bekannte Ports,Welche Anwendung verwendet typischerweise Port 22?,FTP,HTTP,SSH,SMTP,SSH,Port 22 wird typischerweise für SSH (Secure Shell) verwendet.
Bekannte Ports,Welche Anwendung verwendet typischerweise Port 21?,SSH,HTTP,FTP,SMTP,FTP,Port 21 wird typischerweise für FTP (File Transfer Protocol) verwendet.
Bekannte Ports,Welche Anwendung verwendet typischerweise Port 25?,SMTP,HTTP,SSH,FTP,SMTP,Port 25 wird typischerweise für SMTP (Simple Mail Transfer Protocol) verwendet.
Bekannte Ports,Welche Anwendung verwendet typischerweise Port 53?,DNS,HTTP,SSH,FTP,DNS,Port 53 wird typischerweise für DNS (Domain Name System) verwendet.
Bekannte Ports,Welche Anwendung verwendet typischerweise Port 23?,SSH,HTTP,FTP,Telnet,Telnet,Port 23 wird typischerweise für Telnet verwendet.
Bekannte Ports,Welche Anwendung verwendet typischerweise Port 110?,FTP,HTTP,POP3,SMTP,POP3,Port 110 wird typischerweise für POP3 (Post Office Protocol Version 3) verwendet.
Bekannte Ports,Welche Anwendung verwendet typischerweise Port 143?,IMAP,HTTP,SSH,FTP,IMAP,Port 143 wird typischerweise für IMAP (Internet Message Access Protocol) verwendet.
Bekannte Ports,Welche Anwendung verwendet typischerweise Port 161?,SNMP,HTTP,SSH,FTP,SNMP,Port 161 wird typischerweise für SNMP (Simple Network Management Protocol) verwendet.
Bekannte Ports,Welche Anwendung verwendet typischerweise Port 389?,LDAP,HTTP,SSH,FTP,LDAP,Port 389 wird typischerweise für LDAP (Lightweight Directory Access Protocol) verwendet.
Bekannte Ports,Welche Anwendung verwendet typischerweise Port 3389?,FTP,HTTP,SSH,RDP,RDP,Port 3389 wird typischerweise für RDP (Remote Desktop Protocol) verwendet.
Bekannte Ports,Welche Anwendung verwendet typischerweise Port 3306?,FTP,HTTP,SSH,MySQL,MySQL,Port 3306 wird typischerweise für MySQL-Datenbankverbindungen verwendet.
Bekannte Ports,Welche Anwendung verwendet typischerweise Port 1521?,FTP,HTTP,SSH,Oracle,Oracle,Port 1521 wird typischerweise für Oracle-Datenbankverbindungen verwendet.
Bekannte Ports,Welche Anwendung verwendet typischerweise Port 1433?,FTP,HTTP,SSH,Microsoft SQL Server,Microsoft SQL Server,Port 1433 wird typischerweise für Microsoft SQL Server-Datenbankverbindungen verwendet.
Bekannte Ports,Welche Anwendung verwendet typischerweise Port 3128?,FTP,HTTP,HTTPS,Proxy,Proxy,Port 3128 wird typischerweise für HTTP-Proxyverbindungen verwendet.
Bekannte Ports,Welche Anwendung verwendet typischerweise Port 445?,FTP,HTTP,SSH,SMB,SMB,Port 445 wird typischerweise für SMB (Server Message Block) verwendet.
Bekannte Ports,Welche Anwendung verwendet typischerweise Port 990?,FTP,HTTP,HTTPS,FTPS,FTPS,Port 990 wird typischerweise für FTPS (FTP über SSL/TLS) verwendet.
Bekannte Ports,Welche Anwendung verwendet typischerweise Port 23?,FTP,HTTP,SSH,Telnet,Telnet,Port 23 wird typischerweise für Telnet verwendet.
Bekannte Ports,Welche Anwendung verwendet typischerweise Port 443?,FTP,HTTP,HTTPS,SNMP,HTTPS,Port 443 wird typischerweise für HTTPS-Verbindungen verwendet.
Wirtschaft und Soziales,Was ist die Hauptaufgabe der Bilanz?,Vermögenslage darstellen,Erfolgsermittlung,Vertriebsplanung,Personalplanung,Vermögenslage darstellen,Die Bilanz gibt einen Überblick über das Vermögen und die Schulden eines Unternehmens.
Wirtschaft und Soziales,Welches Gesetz regelt den Arbeitsvertrag?,BGB,StGB,HGB,AGB,BGB,Das Bürgerliche Gesetzbuch (BGB) regelt die Grundlagen des Arbeitsvertrags.
Wirtschaft und Soziales,Wie lange beträgt die gesetzliche Kündigungsfrist für Arbeitnehmer in der Probezeit?,2 Wochen,1 Monat,3 Monate,6 Monate,2 Wochen,In der Probezeit beträgt die gesetzliche Kündigungsfrist zwei Wochen.
